<?xml version="1.0" encoding="UTF-8" ?>
<persons xmlns:xsi="http://www.w3.org/2001/XMLSchema-instance"
         xmlns="http://it-academy.by/jd2018-11-13/denisova"
         xsi:schemaLocation="http://it-academy.by/jd2018-11-13/denisova english.xsd"
>
    <person>
        <email></email>
        <nickname></nickname>
        <password></password>
        <themes>
            <theme>
                <name>Animals</name>
                <lessons>
                    <lesson>
                        <name>Animals read</name>
                        <level>Easy</level>
                        <theory> (some theory) example: leon lives 10 years</theory>
                        <test>
                            <name>first</name>
                            <questions>
                                <question>
                                    <name>how many lives lion?</name>
                                    <answers>
                                        <answer>10 years</answer>
                                    </answers>
                                </question>
                            </questions>
                        </test>
                    </lesson>
                </lessons>
            </theme>
        </themes>
    </person>
</persons>